{
  "id": "scan-for-malware-quarantine",
  "name": "Scan for Malware & Quarantine",
  "version": "1.0.0",
  "contract_version": "v1.0.0",
  "description": "Inspect recovered binaries for dangerous payloads, scripts, and quarantine suspicious items.",
  "author": "Drive Rescue Core Team",
  "triggers": {
    "always_available": true
  },
  "runtime": {
    "type": "python_module",
    "entrypoint": "skills.scan_for_malware_quarantine.skill:ScanForMalwareQuarantineSkill",
    "timeout_ms": 30000
  },
  "rollout": { "strategy": "direct", "weight": 100, "is_active": true },
  "capabilities": ["malware_heuristic_scan", "quarantine_isolation", "integrity_signature_verification"]
}
